{
  "format": "sditadc-map",
  "version": 1,
  "name": "MovingAI 仓库",
  "grid": {
    "width": 161,
    "height": 63,
    "rows": [
      "#################################################################################################################################################################",
      "#...............................................................................................................................................................#",
      "#.........................RRRRRRRRRR.RRRRRRRRRR.RRRRRRRRRR.RRRRRRRRRR.RRRRRRRRRR.RRRRRRRRRR.RRRRRRRRRR.RRRRRRRRRR.RRRRRRRRRR.RRRRRRRRRR.........................#",
      "#.........................RRRRRRRRRR.RRRRRRRRRR.RRRRRRRRRR.RRRRRRRRRR.RRRRRRRRRR.RRRRRRRRRR.RRRRRRRRRR.RRRRRRRRRR.RRRRRRRRRR.RRRRRRRRRR.........................#",
      "#...............................................................................................................................................................#",
      "#.........................RRRRRRRRRR.RRRRRRRRRR.RRRRRRRRRR.RRRRRRRRRR.RRRRRRRRRR.RRRRRRRRRR.RRRRRRRRRR.RRRRRRRRRR.RRRRRRRRRR.RRRRRRRRRR.........................#",
      "#.........................RRRRRRRRRR.RRRRRRRRRR.RRRRRRRRRR.RRRRRRRRRR.RRRRRRRRRR.RRRRRRRRRR.RRRRRRRRRR.RRRRRRRRRR.RRRRRRRRRR.RRRRRRRRRR.........................#",
      "#...............................................................................................................................................................#",
      "#.........................RRRRRRRRRR.RRRRRRRRRR.RRRRRRRRRR.RRRRRRRRRR.RRRRRRRRRR.RRRRRRRRRR.RRRRRRRRRR.RRRRRRRRRR.RRRRRRRRRR.RRRRRRRRRR.........................#",
      "#.........................RRRRRRRRRR.RRRRRRRRRR.RRRRRRRRRR.RRRRRRRRRR.RRRRRRRRRR.RRRRRRRRRR.RRRRRRRRRR.RRRRRRRRRR.RRRRRRRRRR.RRRRRRRRRR.........................#",
      "#...............................................................................................................................................................#",
      "#.........................RRRRRRRRRR.RRRRRRRRRR.RRRRRRRRRR.RRRRRRRRRR.RRRRRRRRRR.RRRRRRRRRR.RRRRRRRRRR.RRRRRRRRRR.RRRRRRRRRR.RRRRRRRRRR.........................#",
      "#.........................RRRRRRRRRR.RRRRRRRRRR.RRRRRRRRRR.RRRRRRRRRR.RRRRRRRRRR.RRRRRRRRRR.RRRRRRRRRR.RRRRRRRRRR.RRRRRRRRRR.RRRRRRRRRR.........................#",
      "#...............................................................................................................................................................#",
      "#.........................RRRRRRRRRR.RRRRRRRRRR.RRRRRRRRRR.RRRRRRRRRR.RRRRRRRRRR.RRRRRRRRRR.RRRRRRRRRR.RRRRRRRRRR.RRRRRRRRRR.RRRRRRRRRR.........................#",
      "#.........................RRRRRRRRRR.RRRRRRRRRR.RRRRRRRRRR.RRRRRRRRRR.RRRRRRRRRR.RRRRRRRRRR.RRRRRRRRRR.RRRRRRRRRR.RRRRRRRRRR.RRRRRRRRRR.........................#",
      "#...............................................................................................................................................................#",
      "#.........................RRRRRRRRRR.RRRRRRRRRR.RRRRRRRRRR.RRRRRRRRRR.RRRRRRRRRR.RRRRRRRRRR.RRRRRRRRRR.RRRRRRRRRR.RRRRRRRRRR.RRRRRRRRRR.........................#",
      "#.........................RRRRRRRRRR.RRRRRRRRRR.RRRRRRRRRR.RRRRRRRRRR.RRRRRRRRRR.RRRRRRRRRR.RRRRRRRRRR.RRRRRRRRRR.RRRRRRRRRR.RRRRRRRRRR.........................#",
      "#...............................................................................................................................................................#",
      "#.........................RRRRRRRRRR.RRRRRRRRRR.RRRRRRRRRR.RRRRRRRRRR.RRRRRRRRRR.RRRRRRRRRR.RRRRRRRRRR.RRRRRRRRRR.RRRRRRRRRR.RRRRRRRRRR.........................#",
      "#.........................RRRRRRRRRR.RRRRRRRRRR.RRRRRRRRRR.RRRRRRRRRR.RRRRRRRRRR.RRRRRRRRRR.RRRRRRRRRR.RRRRRRRRRR.RRRRRRRRRR.RRRRRRRRRR.........................#",
      "#...............................................................................................................................................................#",
      "#.........................RRRRRRRRRR.RRRRRRRRRR.RRRRRRRRRR.RRRRRRRRRR.RRRRRRRRRR.RRRRRRRRRR.RRRRRRRRRR.RRRRRRRRRR.RRRRRRRRRR.RRRRRRRRRR.........................#",
      "#.........................RRRRRRRRRR.RRRRRRRRRR.RRRRRRRRRR.RRRRRRRRRR.RRRRRRRRRR.RRRRRRRRRR.RRRRRRRRRR.RRRRRRRRRR.RRRRRRRRRR.RRRRRRRRRR.........................#",
      "#...............................................................................................................................................................#",
      "#.........................RRRRRRRRRR.RRRRRRRRRR.RRRRRRRRRR.RRRRRRRRRR.RRRRRRRRRR.RRRRRRRRRR.RRRRRRRRRR.RRRRRRRRRR.RRRRRRRRRR.RRRRRRRRRR.........................#",
      "#.........................RRRRRRRRRR.RRRRRRRRRR.RRRRRRRRRR.RRRRRRRRRR.RRRRRRRRRR.RRRRRRRRRR.RRRRRRRRRR.RRRRRRRRRR.RRRRRRRRRR.RRRRRRRRRR.........................#",
      "#...............................................................................................................................................................#",
      "#.........................RRRRRRRRRR.RRRRRRRRRR.RRRRRRRRRR.RRRRRRRRRR.RRRRRRRRRR.RRRRRRRRRR.RRRRRRRRRR.RRRRRRRRRR.RRRRRRRRRR.RRRRRRRRRR.........................#",
      "#.........................RRRRRRRRRR.RRRRRRRRRR.RRRRRRRRRR.RRRRRRRRRR.RRRRRRRRRR.RRRRRRRRRR.RRRRRRRRRR.RRRRRRRRRR.RRRRRRRRRR.RRRRRRRRRR.........................#",
      "#...............................................................................................................................................................#",
      "#.........................RRRRRRRRRR.RRRRRRRRRR.RRRRRRRRRR.RRRRRRRRRR.RRRRRRRRRR.RRRRRRRRRR.RRRRRRRRRR.RRRRRRRRRR.RRRRRRRRRR.RRRRRRRRRR.........................#",
      "#.........................RRRRRRRRRR.RRRRRRRRRR.RRRRRRRRRR.RRRRRRRRRR.RRRRRRRRRR.RRRRRRRRRR.RRRRRRRRRR.RRRRRRRRRR.RRRRRRRRRR.RRRRRRRRRR.........................#",
      "#...............................................................................................................................................................#",
      "#.........................RRRRRRRRRR.RRRRRRRRRR.RRRRRRRRRR.RRRRRRRRRR.RRRRRRRRRR.RRRRRRRRRR.RRRRRRRRRR.RRRRRRRRRR.RRRRRRRRRR.RRRRRRRRRR.........................#",
      "#.........................RRRRRRRRRR.RRRRRRRRRR.RRRRRRRRRR.RRRRRRRRRR.RRRRRRRRRR.RRRRRRRRRR.RRRRRRRRRR.RRRRRRRRRR.RRRRRRRRRR.RRRRRRRRRR.........................#",
      "#...............................................................................................................................................................#",
      "#.........................RRRRRRRRRR.RRRRRRRRRR.RRRRRRRRRR.RRRRRRRRRR.RRRRRRRRRR.RRRRRRRRRR.RRRRRRRRRR.RRRRRRRRRR.RRRRRRRRRR.RRRRRRRRRR.........................#",
      "#.........................RRRRRRRRRR.RRRRRRRRRR.RRRRRRRRRR.RRRRRRRRRR.RRRRRRRRRR.RRRRRRRRRR.RRRRRRRRRR.RRRRRRRRRR.RRRRRRRRRR.RRRRRRRRRR.........................#",
      "#...............................................................................................................................................................#",
      "#.........................RRRRRRRRRR.RRRRRRRRRR.RRRRRRRRRR.RRRRRRRRRR.RRRRRRRRRR.RRRRRRRRRR.RRRRRRRRRR.RRRRRRRRRR.RRRRRRRRRR.RRRRRRRRRR.........................#",
      "#.........................RRRRRRRRRR.RRRRRRRRRR.RRRRRRRRRR.RRRRRRRRRR.RRRRRRRRRR.RRRRRRRRRR.RRRRRRRRRR.RRRRRRRRRR.RRRRRRRRRR.RRRRRRRRRR.........................#",
      "#...............................................................................................................................................................#",
      "#.........................RRRRRRRRRR.RRRRRRRRRR.RRRRRRRRRR.RRRRRRRRRR.RRRRRRRRRR.RRRRRRRRRR.RRRRRRRRRR.RRRRRRRRRR.RRRRRRRRRR.RRRRRRRRRR.........................#",
      "#.........................RRRRRRRRRR.RRRRRRRRRR.RRRRRRRRRR.RRRRRRRRRR.RRRRRRRRRR.RRRRRRRRRR.RRRRRRRRRR.RRRRRRRRRR.RRRRRRRRRR.RRRRRRRRRR.........................#",
      "#...............................................................................................................................................................#",
      "#.........................RRRRRRRRRR.RRRRRRRRRR.RRRRRRRRRR.RRRRRRRRRR.RRRRRRRRRR.RRRRRRRRRR.RRRRRRRRRR.RRRRRRRRRR.RRRRRRRRRR.RRRRRRRRRR.........................#",
      "#.........................RRRRRRRRRR.RRRRRRRRRR.RRRRRRRRRR.RRRRRRRRRR.RRRRRRRRRR.RRRRRRRRRR.RRRRRRRRRR.RRRRRRRRRR.RRRRRRRRRR.RRRRRRRRRR.........................#",
      "#...............................................................................................................................................................#",
      "#.........................RRRRRRRRRR.RRRRRRRRRR.RRRRRRRRRR.RRRRRRRRRR.RRRRRRRRRR.RRRRRRRRRR.RRRRRRRRRR.RRRRRRRRRR.RRRRRRRRRR.RRRRRRRRRR.........................#",
      "#.........................RRRRRRRRRR.RRRRRRRRRR.RRRRRRRRRR.RRRRRRRRRR.RRRRRRRRRR.RRRRRRRRRR.RRRRRRRRRR.RRRRRRRRRR.RRRRRRRRRR.RRRRRRRRRR.........................#",
      "#...............................................................................................................................................................#",
      "#.........................RRRRRRRRRR.RRRRRRRRRR.RRRRRRRRRR.RRRRRRRRRR.RRRRRRRRRR.RRRRRRRRRR.RRRRRRRRRR.RRRRRRRRRR.RRRRRRRRRR.RRRRRRRRRR.........................#",
      "#.........................RRRRRRRRRR.RRRRRRRRRR.RRRRRRRRRR.RRRRRRRRRR.RRRRRRRRRR.RRRRRRRRRR.RRRRRRRRRR.RRRRRRRRRR.RRRRRRRRRR.RRRRRRRRRR.........................#",
      "#...............................................................................................................................................................#",
      "#.........................RRRRRRRRRR.RRRRRRRRRR.RRRRRRRRRR.RRRRRRRRRR.RRRRRRRRRR.RRRRRRRRRR.RRRRRRRRRR.RRRRRRRRRR.RRRRRRRRRR.RRRRRRRRRR.........................#",